,title,rating,calories,protein,fat,sodium,vegetarian
8642,Meatballs with Bulgur in Onion and Tomato Sauce (Voli Me Plyguri),3.75,508,29,31,541,0
8643,Swiss Chard with Raisins and Pine Nuts,4.375,311,6,26,368,1
8644,Strawberry-Rhubarb Semifreddo,4.375,451,6,26,214,1
8645,Plum Oatmeal Crisp,3.75,569,6,21,156,0
8646,"Fish and Vegetable Soup with Lime, Ginger, and Cilantro",4.375,258,45,6,756,0
8647,Raspberry Coconut Squares,3.75,333,3,15,125,1
8648,"Creamed Leeks with Tarragon, Tomato, and Bacon",4.375,333,10,17,313,0
8649,Thai-Style Beef and Asparagus Curry,3.125,555,26,49,84,0
8650,Smoked Salmon Platter with Dill Sour Cream,4.375,84,11,4,413,0
8651,"Pasta with Goat Cheese, Lemon, and Asparagus",3.125,442,16,15,120,1
8652,Deviled Eggs with Sun-Dried Tomatoes and Chives,3.75,65,4,5,45,1
8653,Spinach Risotto,4.375,782,30,26,1029,0
8654,Leafy No-Lettuce Salad,5.0,224,11,16,343,1
8655,Steak with Mustard and Green Peppercorns,4.375,604,40,44,290,0
8656,Cranberry Apricot Pecan Strudel,4.375,362,3,17,95,0
8657,Lemon-Ginger Cake with Pistachios,3.75,1093,18,55,614,0
8658,Whole Wheat Bread with Raisins and Walnuts,3.75,267,8,7,583,0
8659,Mussels in Carrot Ginger Broth,4.375,19,2,1,43,0
8660,Celery and Jícama Sauté,3.75,82,2,4,409,1
8661,Rice Pudding with Dried Cherries and Vanilla,3.75,231,8,2,131,1
8662,Pan Fried Potatoes with Paprika and Lemon,2.5,307,6,10,16,1
8663,Supper Clam Chowder,3.75,592,48,19,782,0
8664,Cranberry-Vodka Punch,4.375,267,1,0,4,0
8665,Buttermilk Doughnuts,3.75,383,5,18,481,0
8666,Soy-Glazed Beef Burger,3.75,454,28,32,910,0
8667,Grilled Steak and Onions with Rosemary-Balsamic Butter Sauce,3.75,906,40,59,140,0
8668,Mushroom Croque-Monsieur,4.375,771,38,48,1263,0
8669,Panfried Flank Steak with Mushroom Ragoût,4.375,409,40,25,833,0
8670,Spiced Tuna Steaks with Fennel and Red Peppers,3.75,390,46,13,203,0
8671,Strawberry Margarita Ice Pops,3.75,104,0,0,1,0
8672,Chive-Corn Muffins,3.75,224,6,8,501,0
8673,"5-Grain Porridge with Bee Pollen, Apples, and Coconut",3.125,391,9,10,245,1
8674,Kaffir Lime Mousse with Honeydew Water,5.0,299,6,10,83,0
8675,Cowboy Flatbread Topped with Arugula Salad and Lemon-Pepper Dressing,3.75,544,11,31,689,1
8676,Spiced Hot Chocolate,4.375,224,4,12,45,0
8677,Candied Sweet-Potato Purée,3.75,338,4,9,199,1
8678,Grapefruit Gimlet,5.0,192,0,0,13,0
8679,Walnut Mini-Loaves,5.0,549,13,21,879,0
8680,Ginger Vinaigrette,4.375,554,2,55,1177,0
8681,Indian-Spiced Shrimp,4.375,180,17,9,1087,0
8682,Prosciutto-Roasted Halibut with Fresh Thyme,3.75,258,29,13,302,0
8683,Vanilla Panna Cotta with Mixed-Berry Compote,5.0,333,3,14,19,0
8684,Portobello Mushroom Burgers with Basil-Mustard Sauce,4.375,406,2,42,316,1
8685,Balsamic and Tomato Roast Chicken,3.75,493,42,21,340,0
8686,Linguine and Zucchini with Bagna Cauda Sauce,3.75,506,13,23,56,0
8687,Mexican Pineapple Salad,4.375,343,3,15,10,1
8688,Toasted Hazelnut Salad with Dried Cranberries and Hazelnut Vinaigrette,4.375,196,3,15,20,1
8689,Oatmeal Lace Cookies,3.75,91,1,4,25,0
8690,German-Style Potato and Ham Salad,4.375,410,14,19,1060,0
8691,Risotto Primavera,3.75,529,28,16,975,0
8692,Herbed Polenta Triangles,4.375,197,6,6,52,0
8693,Brown Sugar and Coffee Barbecue Sauce,3.75,158,3,4,260,0
8694,Whole Wheat Pancakes with Bananas and Pecans,4.375,141,4,6,201,1
8695,Skewered Scallops with Orange-Sesame Dipping Sauce,4.375,185,10,9,394,0
8696,Rib-Eye Steaks with Curried Salt,4.375,891,65,70,1609,0
8697,"Artichoke, Fresh Mozzarella, and Salami Sandwiches",4.375,628,37,45,1655,0
8698,Fried Neopolitan Pizzas,4.375,826,20,63,1253,0
8699,Smoked Duck and Walnuts with Winter Greens,5.0,152,4,13,26,0
8700,"Corn Bread with Basil, Roasted Red Peppers and Monterey Jack Cheese",4.375,326,10,14,599,0
8701,Cranberry Tangerine Conserve,5.0,209,1,0,12,1
8702,Aztec Sluggers,4.375,394,2,25,23,0
8703,Bing Cherry and Raspberry Sauce,5.0,110,1,0,1,1
8704,Irene's Beer Stew,3.75,460,40,22,973,0
8705,"Cucumber, Radish, and Tomato Salad with Citrus Dressing",3.75,126,2,10,32,0
8706,Miniature Crab Cakes with Mustard Mayonnaise,4.375,44,2,4,89,0
8707,Butter Braised Oysters on Greens,4.375,355,8,16,49,0
8708,Roasted Butternut Squash Soup,3.75,192,7,7,77,0
8709,Chocolate Mascarpone Mousse with Bananas,4.375,259,2,19,78,0
8710,"Fettuccine with Walnuts, Zucchini Ribbons, and Pecorino Romano",3.75,428,20,10,703,0
8711,Mint Julep Spritzer,5.0,145,1,0,26,0
8712,Apricot Pear Cordials,5.0,441,2,11,6,0
8713,Maple Crème Caramel,5.0,505,6,19,59,0
8714,Vegetables Glazed with Balsamic Vinegar,3.75,128,3,7,15,1
8715,Chicken Laap,4.375,272,25,13,429,0
8716,Grilled Chicken and Vegetable Sandwiches with Tarragon Mayonnaise,4.375,500,14,30,659,0
8717,"Spaghetti with Pepperoni, Peas, and Browned Onions",3.125,786,32,29,921,0
8718,Turtle Bars,3.75,284,2,17,51,1
8719,Pasta with Butternut Squash and Spinach,3.75,583,23,14,367,1
8720,Grilled Pork Chops with Anise-Seed Rub and Mango Mojo,4.375,497,42,29,1565,0
8721,Celery Root Soup,2.5,156,7,5,567,1
8722,Peanut Butter Cheesecake with Peanut Brittle,3.75,320,9,25,146,1
8723,Our Favorite Pie Dough,3.75,235,3,13,235,0
8724,Blueberry Lemon Crumbles,4.375,165,2,8,53,1
8725,Marscarpone Cream,5.0,234,2,23,58,1
8726,"Crispy Za'atar Fish with Israeli Couscous, Swiss Chard, and Feta",4.375,280,18,15,564,0
8727,Anchovies in Tomato Sauce with Pasta,3.75,1084,27,51,817,0
8728,Fresh Tomato and Onion Chutney,3.75,68,1,5,468,0
8729,Honey-Cardamom Custards with Strawberry-Orange Compote,5.0,300,9,12,156,1
8730,Blueberry Lemon Corn Muffins,3.75,853,13,31,315,1
8731,Black Bean Ancho Chili,4.375,678,31,21,353,0
8732,Baked Hawaiian Islands,3.125,966,15,39,1077,1
8733,Spice Cupcakes with Cream-Cheese Icing,3.125,201,2,8,151,0
8734,Herbed-Cheese and Zucchini Omelet,3.75,507,28,39,503,1
8735,Shaved Asparagus with Parmesan Vinaigrette,4.375,431,33,17,135,1
8736,Grilled Portobello Burgers with Piquillo Pepper Aïoli and Watercress,5.0,505,17,32,744,1
8737,Peppercorn Steaks with Bourbon Sauce,4.375,683,40,49,201,0
8738,Pork Kebabs al Pastor,3.125,641,32,34,137,0
8739,Croutes au Fromage,4.375,255,8,18,156,0
8740,"Tomato, Red Onion, and Basil Bruschetta",5.0,443,11,20,660,1
8741,Apple and Celery Salad with Peanuts,3.75,139,2,10,42,0
8742,Herbed Lima Bean Hummus,4.375,169,5,9,303,1
8743,Cornmeal Harvest Loaves,3.75,279,10,2,599,0
8744,"Potato and Roasted Garlic Soup with Wheat Berry, Watercress, and Endive Salad",3.125,443,9,18,352,1
8745,Celery Root Bisque with Thyme Croutons,4.375,215,6,13,177,0
8746,Grapefruit Tart,4.375,225,3,13,145,1
8747,Strawberry Coconut Pineapple Shake,5.0,196,2,6,47,1
8748,Chicken with Coconut Curry Sauce,3.75,246,12,21,50,0
8749,Spicy Dill Pickles,4.375,180,5,1,1456,0
8750,Tangy Avocado-Orange Salad,3.75,111,2,5,11,1
8751,Cumin-Crusted Monster Pork Chop with Peach Chipotle Salsa,4.375,411,18,33,867,0
8752,Broiled Salmon with Apple-Date Chutney,4.375,638,35,41,64,0
8753,Layered Chicken Enchiladas with Tomatillo-Cilantro Sauce,4.375,502,42,25,536,0
8754,Chocolate Sauce,5.0,496,3,28,44,1
8755,Rhubarb and Ricotta Cheese Puff-Pastry Tartlets,4.375,708,13,32,231,0
8756,"Potato Latkes with Smoked Salmon, Caviar, and Tarragon Crème Fraîche",5.0,117,7,4,352,0
8757,Herbed Cream Cheese Cucumber Rounds,4.375,13,0,1,23,0
8758,Crab Cakes with Green Onion and Dill,3.125,308,12,12,617,0
8759,Rice with Julienned Carrots,3.75,430,7,6,613,1
8760,Drunken Raspberries,4.375,241,2,1,6,1
8761,Quick Paella,3.125,500,25,15,538,0
8762,Honeyed Walnut Tart,5.0,419,7,19,124,1
8763,Snapper with Tapenade and Radish and Chive Salad,3.75,767,41,61,528,0
8764,Bake-Salé Lemon Meringue Pie,3.75,464,4,19,361,0
8765,Potato and Portobello Mushroom Gratin,3.75,295,5,16,480,1
8766,Corn Bread Panzanella,3.75,605,15,33,953,0
8767,"Red Snapper with Cilantro, Garlic, and Lime",3.75,162,8,14,290,0
8768,Royal Blueberry Ice Pops,3.125,83,1,1,14,0
8769,Spaghetti with Green Chili-Pine Nut Meatballs,4.375,295,15,9,327,0
8770,Seared Foie Gras and Lingonberry Jam on Brioche Toast,3.75,185,4,10,174,0
8771,Pacific Salmon with Roasted Garlic,4.375,229,6,21,18,0
8772,"Watermelon, Green Onion, and Mint Salad",4.375,127,1,9,6,0
8773,Orange Blossom Cheesecake with Raspberry and Pomegranate Sauce,4.375,945,14,60,717,1
8774,Sesame Beef and Snow Pea Soup,3.75,417,23,13,942,0
8775,Tuna Kebabs with Ginger-Chile Marinade,5.0,435,43,20,527,0
8776,Apple and Blackberry Pie,4.375,597,7,25,514,1
8777,Spicy Crab Spaghettini with Preserved Lemon,3.75,447,19,21,574,0
8778,Rum Punch with Passion Fruit and Lime,5.0,703,6,1,18,0
8779,Danish Pastry Braid,5.0,332,6,20,72,0
8780,Classic Spinach-Artichoke Dip with Mozzarella and Parmesan,4.375,269,11,20,671,1
8781,Buttermilk Pie Crust Dough,5.0,259,4,15,252,0
8782,"""Opulent"" Chicken",3.75,660,54,39,373,0
8783,"Shrimp, Vegetable and Cashew Stir-Fry",3.75,618,31,16,1593,0
8784,Cabbage and Tomato Slaw with Sherry-Mustard Viniagrette,3.75,234,3,19,56,1
8785,Maple Apple Pandowdy with Dried Cranberries,4.375,203,1,3,101,0
8786,Zucchini Pancakes with Basil Chive Cream,3.75,88,2,6,294,1
8787,Purple Potatoes with Sour Cream and Caviar,2.5,104,3,3,81,0
8788,Chestnut Risotto with Butternut Squash,3.75,432,13,13,206,0
8789,Yam and Black Bean Burritos with Amaranth,5.0,494,15,6,509,1
8790,Berry Toast Cups,5.0,376,7,14,303,1
8791,"Puff Pastry Turnovers with Shrimp, Scallops and Spinach",4.375,477,12,33,401,0
8792,Glazed Blueberry-Blackberry Turnovers,5.0,218,2,4,193,1
8793,Louisiana Jambalaya,4.375,519,17,26,1165,0
8794,Cauliflower Risotto with Brie and Almonds,3.75,554,19,24,817,0
8795,"Jasmine Rice with Garlic, Ginger, and Cilantro",4.375,328,8,7,266,0
8796,Ginger Garlic Green Beans,4.375,79,3,4,233,1
8797,"Shaved Fennel, Radish, and Grapefruit Salad",2.5,355,11,11,680,1
8798,Miso-Glazed Black Cod on Sunflower Sprouts,4.375,228,33,6,97,0
8799,Mustard and Dill Vinaigrette,2.5,168,0,18,15,0
8800,"Prosciutto, Goat Cheese, and Fig Sandwiches",3.75,236,17,15,1203,0
8801,"Mint-Marinated Shrimp with Tabbouleh, Tomatoes, and Feta",4.375,564,17,31,1371,0
8802,Orange-Pineapple Carrot Cake,4.375,660,7,35,559,1
8803,Curried Peanut Soup,4.375,490,18,29,299,0
8804,Poblano Cream Soup,3.125,54,1,5,66,0
8805,"Cabbage Packages Filled with Creamed Onions, Bacon and Sage",3.75,215,6,17,1096,0
8806,"Sausage and White Bean ""Cassoulet""",3.75,771,49,24,1017,0
8807,Asparagus and Leek Risotto with Prosciutto,4.375,539,22,18,629,0
8808,Blueberry Compote,5.0,179,1,0,3,1
8809,"Grilled Swiss Cheese, Tuna and Red Pepper Sandwiches",3.75,777,49,52,766,0
8810,Miso Glazed Sea Bass,4.375,273,33,4,560,0
8811,"Seared Halibut with Haricots Verts, Scallions, and White Wine Sauce",5.0,509,40,33,201,0
8812,Watercress Salad With Warm Mustard Dressing,5.0,135,7,11,555,1
8813,Ham and Horseradish Stuffed Eggs,4.375,39,1,4,71,0
8814,Lemon Meringue Ice Cream Pie in Toasted Pecan Crust,5.0,571,8,37,126,1
8815,Ginger-Lime Coconut Cake with Marshmallow Frosting,3.75,1159,17,48,637,1
8816,Braised Escarole with Currants and Pine Nuts,3.75,130,2,10,4,1
8817,Cream of Jerusalem Artichoke and Celery Soup,2.5,311,11,12,367,0
8818,Fresh Vegetable Platter with Olive Oil Dip,3.75,1,0,0,42,0
8819,Winter Salad with Toasted Mustard Seed Vinaigrette,1.25,145,3,11,68,1
8820,Mustard Scallion Potato Salad,3.75,219,5,5,43,1
8821,Sautéed Savoy Cabbage with Scallions and Garlic,3.125,148,4,10,55,1
8822,Crab & Sweet Corn Cakes,3.125,303,17,11,377,0
8823,Chocolate Velvet Ice Cream,4.375,262,4,14,23,0
8824,Ham Mousse in Sherry Aspic,3.75,291,23,17,1355,0
8825,Spring Greens Sauté with Bacon and Walnuts,2.5,99,3,9,229,0
8826,Radicchio Salad With Caramelized Carrots and Onions,4.375,284,5,17,756,1
8827,Sauteed Swiss Chard with Onions,4.375,101,3,7,364,1
8828,Orange-Flower Pavlovas with Strawberries,4.375,181,2,6,26,1
8829,Roasted Sweet Potatoes with Honey Glaze,4.375,335,3,12,17,1
8830,Honey Apple Pie with Orange Lattice Crust,4.375,493,5,27,153,1
8831,Lentil Stew with Spinach and Potatoes,4.375,601,29,15,1495,1
8832,Pistachio-Crusted Scallops,4.375,318,23,21,649,0
8833,Bucatini All'Amatriciana,4.375,755,27,31,692,0
8834,Dill-Pickled Vegetables,5.0,232,2,0,1305,0
8835,Applesauce Cake with Penuche Frosting,2.5,358,3,12,144,0
8836,Filets Mignons with Mustard Port Sauce with Red Onion Confit,4.375,628,34,41,229,0
8837,Dilled Spinach Crepes with Avgolemono Sauce,3.75,440,20,22,595,0
8838,Honey-Mustard Chicken-Sausage Kebabs,5.0,194,8,12,611,0
8839,Asparagus with Wasabi-Mayonnaise Dip,4.375,319,5,30,421,0
8840,Meringue-Topped Raspberry and Peach Ice Cream Cake,5.0,704,8,37,579,1
8841,"Cheddar Biscuits with Fried Eggs, Ham, and Brown Butter",3.75,324,15,22,550,0
8842,Pinon,3.75,798,35,35,716,0
8843,Lemon Crostata,4.375,576,9,34,382,1
8844,Frozen Chocolate Bourbon Parfaits,4.375,454,6,30,60,0
8845,Grilled Quail Salad with Honey-Dijon Dressing,5.0,596,24,45,483,0
8846,Parmesan Walnut Salad in Endive Leaves,4.375,27,1,2,46,0
8847,Southeast Asian Squid Salad,3.75,397,34,19,1288,0
8848,Panettone Bread and Butter Pudding,5.0,496,12,19,180,0
8849,Cinnamon-Walnut Coffee Cake,3.125,332,8,10,696,0
8850,Ultimate Turkey Stock,5.0,314,32,18,137,0
8851,"Cranberry, Pear, and Ginger Chutney",3.75,233,1,0,17,1
8852,Frozen Iced Coffee With Coffee Jelly,4.375,253,3,11,33,0
8853,Paniolo Rack of Lamb,4.375,849,28,68,1327,0
8854,Black and White Crème Brûlée,3.75,304,4,23,25,0
8855,"Lemon, Sage, and Garlic Roast Chicken",3.125,456,47,27,156,0
8856,Raisin Scones,3.125,273,6,8,295,0
8857,Blackberry-Gin Fizz,3.75,212,0,0,2,0
8858,Waffles with Frizzled Ham and Maple-Mustard Cream,4.375,746,20,64,1237,0
8859,Chili-Seasoned Fish Sticks,3.75,589,38,35,380,0
8860,Warm Almond Cakes With Grapes,5.0,518,9,36,113,0
8861,Mirabelle Ginger Tart,2.5,339,5,20,60,1
8862,Sticky Cinnamon Rolls,4.375,307,4,17,91,0
8863,Northwestern Wild Mushroom Stuffing,4.375,290,10,12,243,0
8864,Rice Pilaf with Pistachios and Golden Raisins,4.375,282,8,11,123,0
8865,Pasta with Confit Duck and Savoy Cabbage,4.375,1177,39,64,962,0
8866,Herbed Orzo with Toasted Pine Nuts,3.125,315,9,12,6,1
8867,Glazed Red Pepper-Fennel Almonds,5.0,170,5,13,175,0
8868,Baked French Toast with Cardamom and Marmalade,4.375,468,8,9,241,1
8869,Frozen Strawberry-Banana Cake with Strawberry Sauce,4.375,412,3,6,159,1
8870,Sour Cream Cake with Cardamom and Pistachios,3.125,444,9,22,315,1
8871,Lemon Cloud,2.5,132,5,0,92,0
8872,Chocolate Profiteroles with Coffee Ice Cream and Bittersweet Chocolate Sauce,3.75,160,2,10,17,1
8873,Mixed Grill with Cherry Cola Barbecue Sauce,4.375,885,61,60,820,0
8874,"Cranberry Sauce with Cherries, Marsala and Rosemary",5.0,301,1,0,18,1
8875,Baked Pecan-Stuffed Nectarines,4.375,265,4,15,4,1
8876,Raspberry Galettes,3.75,812,10,38,126,1
8877,Agnolotti with Sweet Peas and Goat Cheese,5.0,527,14,33,856,1
8878,Mango-Pineapple-Lime Cheesecake with Ginger Crust,4.375,590,9,39,332,1
8879,Aged Sherry-Walnut Vinaigrette,4.375,203,1,22,197,0
8880,Polenta Toasts with Goat Cheese and Fresh Thyme,3.75,38,1,1,90,1
8881,Mustard-Crusted Pork With Farro and Carrot Salad,4.375,850,64,42,788,0
8882,"Penne with Pancetta, Sage, and Mushrooms",5.0,796,31,42,711,0
8883,Candied Butternut Squash,3.75,226,2,6,202,1
8884,Orzo Risotto,4.375,187,4,9,371,1
8885,Spiced Mixed Nuts,3.75,224,6,18,204,0
8886,Eggplant Salad with Miso Ginger Dressing,4.375,455,5,41,189,0
8887,Halibut in Chard Leaves with Lemon-Thyme Butter,4.375,400,38,26,271,0
8888,Chimichurri Sauce,3.75,392,2,41,35,0
8889,Vietnamese Fried Rice,3.75,185,10,7,796,1
8890,Black-Eyed Pea and Bacon Salad with Mustard Vinaigrette,3.75,358,9,30,373,0
8891,Hummus Tehina,5.0,151,8,5,694,1
8892,Rosanne Cash's Potato Salad,4.375,334,7,20,503,1
8893,Farinata con Salvia,4.375,259,4,12,582,0
8894,Raspberry and Peach Parfait Cake,3.125,1148,14,72,131,1
8895,Sugar Snap Salad,4.375,111,4,7,26,1
8896,Raisin Ginger Breads,1.25,294,4,11,230,0
8897,Orange Tangerine Pudding,3.75,174,1,6,4,1
8898,Ras El Hanout,3.75,17,0,1,22,0
8899,Grilled Fish with Orange-Fennel Salsa,5.0,435,39,21,514,0
8900,Chocolate Hazelnut Spiced Cookies,3.75,110,2,7,101,1
8901,Red Bell Pepper and Tomato Salad,3.75,117,0,10,2,1
8902,Turkey Osso Buco,4.375,643,67,34,804,0
8903,Dried Fruit Stewed with Brown Sugar and Vanilla,4.375,137,3,2,50,1
8904,Warm Teriyaki Beef Salad,3.75,493,45,29,1450,0
8905,Broccoli with Garlic and Parmesan Cheese,3.75,185,12,11,258,1
8906,Cinnamon Blueberry Muffins,4.375,177,3,7,157,1
8907,Lamb Shank Ragù with Anson Mills Grits,4.375,628,36,34,1183,0
8908,Steamed Asian White Rice,5.0,263,5,0,5,1
8909,Old-Fashioned Chicken and Corn Stew,4.375,452,37,25,136,0
8910,Egg Tacos with Pumpkin-Seed and Tomato-Habanero Sauces,3.75,504,26,42,109,0
8911,Sausage and Potato Breakfast Casserole,4.375,421,21,29,743,0
8912,Lemon Mascarpone Brûlée Tarts with Raspberry Sauce,4.375,968,9,50,273,0
8913,Fresh Hot-Pepper Paste,3.75,138,1,14,339,0
8914,Crisp Chocolate Marshmallow Squares,3.125,38,1,2,40,0
8915,Spring Vegetable Ragoût with Fresh Chervil,2.5,112,4,6,55,1
8916,Marinated London Broil with Lemon and Garlic,3.75,510,45,35,183,0
8917,Curried Chicken,4.375,653,55,35,284,0
8918,White Wine and Peach Sangria,5.0,389,1,0,13,0
8919,Milk Pie,3.125,428,10,20,313,1
8920,Grilled Skirt Steak Tacos with Roasted Poblano Rajas,3.75,88,8,5,173,0
8921,Roasted Beet Salad with Flash-Pickled Radishes and Chard,4.375,286,5,22,178,1
8922,Sage Buttermilk Biscuits with Sausage and Cheddar,4.375,472,19,32,797,0
8923,"Chicken, Green Bean, Corn, and Farro Salad with Goat Cheese",4.375,390,22,22,431,0
8924,Tomales Bay Oysters Rockefellar,5.0,92,7,5,90,0
8925,Parmesan Shortbread with Fennel and Sea Salt,5.0,181,3,13,231,1
8926,Grits with Shrimp and Roasted Red Bell Pepper,4.375,291,14,14,864,0
8927,Agnolotti with Meat and Spinach Filling,3.75,519,28,42,534,0
8928,Mexican Coffee,5.0,189,0,0,9,0
8929,"Smoked Fish with Cucumber ""Noodles""",2.5,234,26,9,835,0
8930,Potato Salad with 7-Minute Eggs and Mustard Vinaigrette,3.75,235,6,12,118,1
8931,Sour Cherry Strudels,3.75,448,5,19,235,0
8932,Creamy Garlic Pasta with Mushrooms and Prosciutto,4.375,598,31,18,1042,0
8933,"Burnt Carrots with Goat Cheese, Parsley, Arugula, and Crispy Garlic Chips",4.375,456,11,22,513,1
8934,"Fettuccine with Chicken, Red Onion and Peppers",4.375,1135,68,52,370,0
8935,Potted Cheese Spread with Crackers,3.75,205,9,18,251,1
8936,"Cod with Lemon, Green Olive, and Onion Relish",4.375,458,31,36,267,0
8937,"Beef Brisket Braised with Dried Fruit, Yams and Carrots",4.375,1107,48,58,340,0
8938,Grilled Sausages with Chunky Tomato Porcini Sauce,3.75,540,26,44,1210,0
8939,Chicken Marsala with Sage,4.375,494,55,24,129,0
8940,Spicy Pecans,3.125,322,4,33,80,1
8941,Frozen Milk Chocolate and Amaretto Mousse Pie,3.75,438,4,25,154,0
8942,"Mushroom, Squash and Bell Pepper Salad",3.75,364,8,29,31,0
8943,Smoked Trout and Arugula Toasts,3.75,146,18,2,692,0
8944,Green Goddess-Chive Dressing,5.0,398,1,42,293,0
8945,Braised Chicken with Green Peppers and Tomatoes,3.75,520,30,38,149,0
8946,Pastry Dough,4.375,230,3,16,100,1
8947,Mexican Floating Island with Kahlua Custard Sauce and Sesame Pumpkin-Seed Brittle,4.375,277,4,7,44,0
8948,Spice-Rubbed Pork Tenderloin With Roasted Baby Carrots,4.375,121,7,8,751,0
8949,Turkey Giblet Stock,5.0,120,3,5,184,0
8950,Blueberry-Lemon Icebox Cake,4.375,426,4,30,191,0
8951,"Crunchy Chicken Salad with Shiitake Mushrooms, Spicy Sesame Dressing and Peanuts",4.375,464,12,44,185,0
8952,Free-Form Beesting Cake,3.125,989,16,44,360,1
8953,Caramelized Fresh Pineapple Tiramisu,4.375,372,9,20,280,1
8954,"Tequila, Apple, and Dried Cranberry Compote",4.375,248,1,1,5,0
8955,Potato and Carrot Gratin Diamonds,3.75,304,8,11,174,1
8956,Indian-Spiced Pickled Vegetables,2.5,200,3,14,61,1
8957,Grilled Pork Chops with Sweet Lemongrass Marinade,5.0,458,43,18,1278,0
8958,Romaine and Red Onion Salad with Parmesan Balsamic Vinaigrette,3.75,383,13,27,467,0
8959,Verjus Relish,3.75,169,1,17,17,1
8960,Wine-Braised Red Cabbage,3.75,147,2,9,63,0
8961,Stuffed Sweet Potatoes,3.125,254,6,13,486,1
8962,Creamy Slaw,3.75,207,3,17,448,1
8963,Crispy Chicken Wings,5.0,582,45,41,1647,0
8964,Apple and Cranberry Crisps with Ginger-Pecan Topping,4.375,576,5,25,164,1
8965,Rigatoni with Eggplant and Pine Nut Crunch,4.375,671,29,37,726,1
8966,Marmalade Cake,3.75,505,5,16,198,1
8967,Steamed Mussels with Tomato and Chorizo Broth,5.0,25,2,1,65,0
8968,Chunky Beef and Vegetable Soup,3.125,372,44,11,798,0
8969,"Grilled Artichokes with Olive Oil, Lemon, and Mint",4.375,342,9,24,242,0
8970,Trout with Tropical Fruit Salsa and Mixed Greens,4.375,486,33,31,98,0
8971,Cowboy Frittata,5.0,248,18,18,402,0
8972,Brandied Black Cherries,5.0,482,2,0,3,0
8973,Cardamom Crescents,5.0,84,1,5,20,1
8974,"Banana, Coffee, Cashew, and Cocoa Smoothie",5.0,124,3,4,32,0
8975,Mac Sauce (Béchamel 101),5.0,248,5,19,691,0
8976,Sage and Pancetta Biscuits with Fontina Cheese,4.375,208,6,12,336,0
8977,Ginger-Garlic Shrimp,3.75,172,18,5,1315,0
8978,Margarita Chicken,3.125,111,5,2,15,0
8979,"Eggplant Steaks with Salad of Roasted Peppers, Olives, Feta and Garbanzo Beans",4.375,367,9,25,487,1
8980,Turkey Burgers with Chipotle-Chili Tartar Sauce,4.375,718,29,52,578,0
8981,Smoky Two Chile Salsa,4.375,14,0,0,38,1
8982,Butterscotch Blondie Bars With Peanut-Pretzel Caramel,3.75,255,6,13,171,1
8983,Green Olive and Goat Cheese Crostini,4.375,83,3,5,228,1
8984,"Couscous Salad with Currants, Pine Nuts, and Celery",5.0,438,7,29,267,0
8985,"""Pot Roast"" of Seitan, Aunt Gloria-Style",2.5,528,38,7,1188,0
8986,Yogurt Cake with Currant Raspberry Sauce,4.375,879,10,27,374,1
8987,Cheddar Dill Biscuits,4.375,153,4,7,252,0
8988,Salmon and Vegetable Chowder,3.75,517,31,30,156,0
8989,Cantaloupe and Prosciutto with Basil Oil,4.375,309,19,23,1552,0
8990,"Braised Bacon, Pomegranate, and Pine Nut Relish",4.375,663,19,57,793,0
8991,Chilled Corn Soup with Crab and Chile Oil,3.75,142,8,5,361,0
8992,Grilled Lamb Kebabs with Coriander and Cumin,4.375,880,55,71,525,0
8993,Dandelion Greens with Hot Olive-Oil Dressing,4.375,244,4,17,390,1
8994,"Arugula, Pear and Stilton Salad",4.375,357,7,29,334,1
8995,Balsamic Strawberries,4.375,180,2,1,5,1
8996,Mustard and Spring Onion Mash,3.75,338,8,14,170,1
8997,Vinegar Slaw,3.75,115,1,9,33,1
8998,Curried Red-Lentil Stew with Vegetables,3.75,434,16,22,833,1
8999,Peach-Raspberry Bundles with Orange Custard Sauce,5.0,483,7,28,172,1
9000,Apricot Custard Tart,3.75,295,4,17,60,1
9001,Long-Cooked Green Beans,3.75,502,10,39,1208,0
9002,Cashew Mousse,2.5,355,6,22,215,0
9003,Halibut in Hazelnut Romesco with Potatoes,4.375,486,37,30,424,0
9004,Margarita II,3.125,181,0,0,163,0
9005,Veal with Sherry Sauce,3.75,211,15,13,685,0
9006,Lemon-Lime Ring with Mixed Berries and Mango,5.0,337,4,15,15,1
9007,Roast Beef with Glazed Onions and Worcestershire Gravy,3.75,913,42,66,359,0
9008,Greek Potato and Almond Dip,3.75,483,6,38,96,1
9009,Scallop Cakes with Cilantro-Lime Mayonnaise and New Potatoes,4.375,301,30,13,1582,0
9010,Rustic Nectarine and Blackberry Crostata with Cornmeal Crust,4.375,400,5,21,230,0
9011,Toasted-Almond Cake with Strawberries in Rosé-Water Syrup,4.375,756,11,39,246,1
9012,Cottage Cheese Rugelach with Walnuts,4.375,89,2,6,58,1
9013,Strawberry-Cheesecake Ice Cream,3.75,228,3,14,156,0
9014,Green Bean and Lemon Casserole,4.375,114,2,9,8,1
9015,Spicy Grilled Chicken with Creamy Pumpkin Mole Sauce,3.75,428,57,17,188,0
9016,Butterscotch Chiffon Pie,3.125,507,6,36,147,0
9017,Ginger-Curry Sugar Cookies,4.375,48,1,3,23,0
9018,Chicken and Mushroom Pie with Phyllo-Parmesan Crust,3.75,749,39,49,1112,0
9019,Spinach Salad with Oranges and Warm Goat Cheese,4.375,269,12,19,539,1
9020,Glazed Apple Rings,3.75,124,1,4,2,0
9021,Fresh Figs with Rosemary Goat Cheese,4.375,204,8,14,185,1
9022,Brown Stock,3.75,67,9,3,87,0
9023,Red Wine and Mushroom Risotto,3.75,753,25,30,530,0
9024,Spinach and Chick Peas with Bacon,4.375,343,12,22,453,0
9025,"Pasta with Roasted Vegetables, Tomatoes and Basil",3.75,429,15,14,153,1
9026,Spice-Rubbed Salmon,3.75,422,35,30,684,0
9027,Red Curry of Lobster and Pineapple,4.375,363,23,23,1650,0
9028,Sea Bass with Spicy Roasted Bell Pepper Sauce,3.75,484,38,30,178,0
9029,Coconut Date Nut Balls,4.375,253,2,9,139,1
9030,Green Beans and Arugula,4.375,88,3,5,308,1
9031,Apple Bread Pudding,3.75,224,7,4,159,1
9032,Strawberry-Rhubarb Compote with Ginger and Lime,5.0,279,3,1,18,1
9033,Pistachio Popover Cremes Brulees with Grand Marnier Syrup,4.375,660,12,30,173,1
9034,Lemon and Amaretti Semifreddo with Raspberry Sauce,4.375,254,4,13,83,0
9035,Mashed Potatoes with Crisp Ham,2.5,323,11,13,384,1
9036,Super-Simple Pumpkin Tiramisu,3.75,643,8,49,197,1
9037,Broiled Steak with Horseradish Cream,3.75,485,40,34,582,0
9038,Meyer Lemon and Vanilla Bean Marmalade,4.375,444,1,0,36,1
9039,Honey-Orange Madeleines,4.375,133,2,8,9,1
9040,Salty Dog,5.0,175,1,0,872,0
9041,Double Chocolate Torte,5.0,852,10,65,148,1
9042,"Melon and Blueberry Coupe with White Wine, Vanilla and Mint",4.375,208,2,1,36,0
9043,Radishes and Scallions,2.5,75,1,6,51,1
9044,"Roasted Celery Root, Red Onions, Mushrooms, and Sage",3.75,274,8,13,875,1
9045,Caesar Salad,5.0,417,9,35,412,0
9046,Spiced Zucchini Bread,5.0,300,4,14,216,1
9047,Scandinavian Sugar-Browned Potatoes,4.375,403,9,6,317,1
9048,Roasted Zucchini Lasagna,1.25,579,38,35,600,1
9049,Asparagus Napoleons with Oriental Black Bean Sauce,4.375,294,7,18,466,0
9050,Queen Elizabeth's Favorite Quiche,3.75,435,17,24,909,0
9051,Chopped Salad,4.375,327,4,34,144,0
9052,Green Beans and Roasted Squash with Sherry Soy Butter,3.75,326,5,19,258,1
9053,Roasted Mushroom and Barley Gravy,3.125,156,4,10,442,1
9054,Peas and Pea Tendrils with Lemon Dressing,3.75,130,4,9,32,1
9055,Orange Fools,3.75,501,5,42,61,0
9056,Fresh Corn Madeleines with Sour Cream and Caviar,3.75,22,1,1,53,0
9057,Green Herb Risotto,4.375,479,11,19,157,0
9058,Chile-Pepper Water,3.75,6,0,0,9,0
9059,Marbleized Root Vegetable Purée,4.375,233,3,12,72,1
9060,Yam Neua,4.375,216,16,14,515,0
9061,Fried Rice,4.375,923,26,23,1666,0
9062,Apple Cider Indian Pudding,3.75,309,4,10,429,1
9063,Verlet's Apricot Tart,5.0,334,5,16,164,1
9064,Lebanese Garlic-Marinated Chicken on the Grill,4.375,507,32,41,415,0
