,title,rating,calories,protein,fat,sodium,vegetarian
2618,Gruyère Potato Gratin,3.125,445,24,20,432,1
2619,Grilled Sirloin Steaks with Blue Cheese-Walnut Butter,4.375,307,18,25,523,0
2620,Shrimp Tikka with Fresh Mango Chutney,5.0,241,22,11,860,0
2621,Banana Bread with Chocolate Chips and Walnuts,4.375,277,4,13,198,1
2622,Corn Pudding,3.75,192,6,8,336,1
2623,Parmesan Breads with Tomato and Onions,3.125,209,9,5,364,0
2624,Spanish Trail Mix,4.375,328,12,21,109,0
2625,Lattice-Crust Pear Pie,4.375,177,1,0,39,1
2626,Pear Maple Johnnycake,3.125,288,5,14,350,1
2627,Tomato Sauce,4.375,40,2,0,779,0
2628,"Sonoran Hot Dogs With Bacon, Pico de Gallo, and Avocado",4.375,508,16,32,1378,0
2629,Lettuce Soup,4.375,129,6,8,265,0
2630,King of Snake Cocktail,5.0,173,0,0,14,0
2631,Orange Rum Caramel Sauce,2.5,384,0,0,2,1
2632,Grilled Potato Salad with Cornichons and Dill,5.0,240,4,12,406,0
2633,Cream Cheese Hamantaschen,3.75,120,2,6,34,1
2634,Stuffed Baked Potatoes with Horseradish Cream,3.75,342,6,18,70,1
2635,Panfried Tofu with Oriental Garlic Sauce,3.125,583,38,40,1285,1
2636,Melon and Prosciutto Risotto,3.75,346,7,10,207,0
2637,"Farfalle with Butternut Squash, Mushrooms and Spinach",3.125,556,20,16,232,1
2638,Cranberry Sauce with Dried Cherries and Red Onion Jam,4.375,322,1,5,69,1
2639,Sesame Carrots,3.75,28,0,2,26,1
2640,Seared Tuna with Green Onion-Wasabi Sauce,4.375,326,45,13,848,0
2641,"Onion, Tomato, and Olive Pizzas",3.75,31,1,1,94,1
2642,Chocolate-Strawberry Ganache,4.375,295,2,18,17,0
2643,Wild Rice Stuffing with Wild Mushrooms,4.375,495,13,14,67,0
2644,Fig-Braised Chicken with Spiced Walnuts,3.75,329,11,21,700,0
2645,"Roasted Potatoes, Shallots, and Kale with Caramelized Garlic Dressing",3.75,313,13,17,74,1
2646,"Bruschetta with Goat Cheese, Roasted Pepper, and Basil",4.375,180,9,7,307,1
2647,Tricked-Up Brisket Rub,4.375,100,3,2,127,0
2648,Shrimp and Noodle Stir Fry,3.125,473,21,17,834,0
2649,Pan-Seared Tilapia with Chile Lime Butter,4.375,262,32,15,471,0
2650,Shrimp Sates with Greek Garlic Sauce,3.75,123,5,9,219,0
2651,Grapefruit with Chile and Rosemary,5.0,69,1,0,0,1
2652,Marinated Leg of Lamb,5.0,145,2,13,369,0
2653,Curried Chili Shrimp,3.75,829,25,17,1187,0
2654,Pork Tenderloin with Spiced Rhubarb Chutney,5.0,444,37,10,102,0
2655,Frangipane Tart with Strawberries and Raspberries,4.375,286,4,19,59,0
2656,Spring Greens with Roasted Beets and Blood Oranges,4.375,213,3,17,60,1
2657,Frozen Lemon Cream Meringue Cake,5.0,260,4,14,39,0
2658,Classic Posole,4.375,567,31,31,762,0
2659,Pasta and Cauliflower Soup Federica,4.375,428,17,25,1039,0
2660,Roasted Monkfish with Fennel-Saffron Compote,4.375,247,32,12,40,0
2661,Gingered Lemon Almond Squares,3.75,251,2,19,23,1
2662,Pepper-Crusted Steak with Horseradish Cream on Grilled Garlic Crostini,5.0,131,9,10,214,0
2663,Root Vegetable Tarte Tatin,5.0,407,8,23,177,1
2664,Chipotle Cheese Fondue,4.375,750,34,52,864,0
2665,Whiskey Flip,5.0,286,5,4,60,0
2666,Mussels with Roasted Potatoes,3.75,237,13,10,554,0
2667,Roasted Cauliflower with Onions and Fennel,4.375,205,4,14,73,1
2668,Streusel Küchen,4.375,711,7,38,252,1
2669,Raspberry Mint Vinegar,5.0,169,4,2,27,0
2670,Mahogany Beef Stew with Red Wine and Hoisin Sauce,4.375,1049,59,60,609,0
2671,Green Onion-Jalapeño Cornbread,4.375,167,4,6,420,1
2672,Salmon Hash with Horseradish-Dill Cream,3.75,734,40,49,280,0
2673,Rice Flaked Red Snapper with Roasted Chile Sauce,3.75,502,40,27,1202,0
2674,Green Bean and Red Onion Salad with Radish Dressing,4.375,161,2,14,45,1
2675,Mushroom Sauté with Goat Cheese Crostini,4.375,220,9,17,201,0
2676,Corn-Jalapeño Fritters,5.0,249,9,12,644,0
2677,"Chocolate Fondue with Candied Orange Peel, Raspberries, and Almond Macaroons",3.75,1020,15,53,923,1
2678,Smoked Oyster and Potato Salad with Arugula,4.375,293,8,15,115,0
2679,"Tomato, Cucumber, and Pita Salad",4.375,202,4,19,311,0
2680,Tropical Fruit Fantasy,4.375,1072,9,32,735,1
2681,Fresh Oranges with Spiced Red Wine Syrup,4.375,269,2,0,4,1
2682,Old-Fashioned Butterscotch Pudding,5.0,800,9,70,131,0
2683,Peach-Amaretto Sundaes,4.375,319,4,11,110,1
2684,Plum Applesauce,5.0,94,1,0,1,1
2685,Cornmeal Buttermilk Waffles Nesbitt,4.375,134,4,7,233,0
2686,Lemon Lime Curd,3.125,227,2,17,26,1
2687,Fish Cakes with Shrimp and Smoked Salmon,3.75,593,26,23,890,0
2688,Candied Cashews,5.0,230,6,18,124,1
2689,Gratin Dauphinoise (Scalloped Potatoes),3.75,228,6,8,42,1
2690,Shrimp de Jonghe,4.375,394,23,28,907,0
2691,Sirloin Steak with Tomato and Cilantro Sauce,4.375,417,29,31,89,0
2692,Black Bottom Oatmeal Pie,5.0,292,4,14,175,1
2693,Tea Bread with Vine Fruit and Pine Nuts,2.5,331,6,15,298,1
2694,"Grilled Sweet Potatoes, Onion, and Bell Pepper with Thyme Vinaigrette",3.125,354,3,18,16,1
2695,Toasted Pita Thins,4.375,13,0,1,12,0
2696,Bourbon Cranberry Sauce,5.0,316,0,0,2,0
2697,"Cavatappi with Tomatoes, Arugula, and Ricotta",5.0,419,14,13,349,1
2698,Chocolate-Almond Soufflé Torte,4.375,714,11,60,62,1
2699,Banana Cream Pie with Salty Bourbon Caramel,4.375,642,12,38,328,1
2700,Quinoa and Bulgur Salad with Feta,3.75,203,6,11,1040,1
2701,"Red Cabbage, Blue Cheese, and Walnut Empañadas",3.75,356,7,17,825,1
2702,Stir-Fried Sesame Baby Bok Choy,4.375,65,3,4,341,1
2703,Lamb Burgers in Pita with Yogurt Sauce,4.375,562,32,29,422,0
2704,Chocolate Cream Pie,5.0,310,4,18,149,0
2705,Do-Ahead Turkey Stock,4.375,103,10,6,37,0
2706,Crunchy Chicken Salad,3.75,531,34,41,858,0
2707,Beef Cheeks Braised in Red Wine with Orange Zest (Joues de Boeuf aux Agrumes),3.75,948,43,58,232,0
2708,Red-Braised Pork (Hong Shao Rou),3.75,283,6,26,372,0
2709,Asparagus Green Onion Sauté,4.375,66,3,4,6,1
2710,Chicken and Mashed Potatoes with Herb-Roasted Tomatoes and Olive Broth,4.375,551,41,38,332,0
2711,"Caramelized Pistachio, Walnut, and Almond Tart",4.375,599,8,44,253,1
2712,Cherry-Apricot Yogurt Sundaes,5.0,146,4,3,39,1
2713,Caramelized Bananas and Vanilla Cream in Phyllo Cups,4.375,524,7,23,182,1
2714,Parchment-Baked Sea Bass with Morels and Red Wine Sauce,3.125,363,54,9,1290,0
2715,Salsa Verde,4.375,88,2,5,446,1
2716,Rob Roy I,3.75,311,2,0,2,0
2717,Sour Cream Ice Cream,5.0,229,4,15,40,1
2718,Rösti with Black Forest Ham and Chives,3.75,695,24,41,596,0
2719,Egg Curry with Tomatoes and Cilantro,1.25,414,17,19,860,1
2720,Roasted Parsnips and Butternut Squash,3.75,272,3,12,231,1
2721,Toasted-Garlic Rice with Fresh Herbs and Lime,4.375,251,6,6,331,0
2722,Roasted Chicken Legs with Jalapeño and Tomato,3.75,586,39,43,213,0
2723,Boiled Dressing,4.375,249,6,20,837,0
2724,Fennel Cucumber Relish,3.75,233,10,12,84,1
2725,Fall Fruits and Vegetables,3.125,864,19,54,706,0
2726,Pineapple Rum Cocktails,3.125,177,1,0,6,0
2727,Mustard-Horseradish Sauce,4.375,298,3,30,444,0
2728,Watermelon and Feta Salad,4.375,89,4,5,230,1
2729,Rosemary and Garlic Roasted Potatoes,4.375,281,5,11,17,1
2730,Brown Oatmeal Soda Bread,3.75,248,10,2,601,0
2731,Banana Orange Crepes,5.0,662,14,36,401,1
2732,Vine Leaf-Wrapped Sheep's-Milk Ricotta with Fennel and Olives,4.375,261,11,16,340,1
2733,Eggs Florentine Plus,4.375,270,21,15,736,0
2734,Lentil Soup Kuppin,3.125,374,19,17,811,0
2735,"Pasta with 15-Minute Ham, Pea, and Cream Sauce",4.375,823,24,37,370,0
2736,Fettucine Carbonara with Fried Eggs,4.375,732,42,33,802,0
2737,Mashed Potatoes with Caramelized Garlic and Parsnips,3.125,349,7,17,44,1
2738,Chawan Mushi with Shrimp and Spring Peas,4.375,87,7,3,133,0
2739,Grilled Gazpacho Salad with Shrimp,4.375,464,21,29,734,0
2740,Curly Endive and Apple Smoked Bacon Salad,5.0,754,16,73,957,0
2741,Mustard Aspic,3.125,112,4,8,37,0
2742,Potato Latkes,5.0,200,2,15,231,1
2743,Grilled Tuna and Mango Salad,4.375,388,43,15,80,0
2744,"Chocolate, Cinnamon, and Hazelnut Thumbprints",4.375,185,2,11,57,1
2745,Crab and Cucumber Pastries with Mustard Sauce,4.375,453,13,35,621,0
2746,Cranberry-Teriyaki Glaze,4.375,171,2,7,1176,0
2747,Chocolate Soufflé,5.0,357,3,22,19,1
2748,Lemon Cream Cheese Frosting,4.375,291,2,18,105,0
2749,"Chinese-Hawaiian ""Barbecued"" Ribs",4.375,640,45,37,1582,0
2750,Stuffed Rolled Tortillas,4.375,197,13,9,567,0
2751,Pear and Pumpkin Pie,4.375,928,6,53,853,0
2752,Pig in a Haystack,4.375,557,31,27,823,0
2753,Mussels with Thai Red Curry,5.0,540,31,41,1062,0
2754,Beets with Mint and Yogurt,3.75,91,4,5,407,1
2755,"Oatmeal, Date, Pecan and Chocolate Chip Cookies",3.75,159,2,8,73,0
2756,"Cocoa Meringue Baskets with Nectarines, Berries, and Cream",2.5,632,8,37,73,1
2757,Lemon Pepper Dressing,4.375,184,0,20,137,0
2758,Caribbean Coconut Curry Sauce,3.75,254,1,11,415,0
2759,Apple-Clove Butter,3.75,252,1,1,10,0
2760,Spicy Straw Potatoes,4.375,804,33,54,323,0
2761,Cream of Tomato Soup with Souffléed Cheese Toasts,3.75,195,8,11,237,1
2762,Lamb Chops with Spicy Peanut Sauce,4.375,660,24,56,1230,0
2763,"Conch Salad, Man!",4.375,242,31,8,1609,0
2764,Chocolate-Pistachio Torte with Warm Chocolate Ganache,3.125,663,13,49,109,1
2765,Herbed Balsamic Chicken with Blue Cheese,4.375,326,39,16,901,0
2766,Scalloped Turkey,3.125,449,28,14,296,0
2767,Quick Plum Preserves,4.375,321,2,0,3,0
2768,Braised Lamb Shanks with Caramelized Onions and Shallots,4.375,1095,64,56,663,0
2769,Brussels Sprouts with Shallots and Wild Mushrooms,4.375,342,6,29,333,0
2770,Garden Vegetable Enchiladas,4.375,538,23,31,844,1
2771,Passion Fruit Champagne Cocktail,5.0,187,3,1,37,1
2772,Raspberry Tart May,4.375,272,4,15,79,0
2773,Penne with Vegetables and Olives,1.875,420,14,16,168,1
2774,Marinated Flank Steak,3.125,271,25,14,68,0
2775,Banana Rum Ice Cream,3.125,277,5,10,44,0
2776,Barbecue-Spiced Grilled Tenderloin Steaks,3.125,419,32,29,82,0
2777,"Cheddar, Bacon, and Scallion Soufflé",4.375,404,21,29,408,0
2778,Deep-Dish Apple Pie with Cheddar Crust,4.375,659,11,28,295,0
2779,Mixed Greens and Fruit with Mustard Dressing,2.5,161,2,12,43,1
2780,Prosciutto with Melon,5.0,91,13,4,1214,0
2781,Fried Rice with Pork and Kale,3.75,960,40,47,1010,0
2782,Cranberry Quince Chutney,4.375,196,1,0,309,0
2783,Couscous Salad with Corn and Red Bell Pepper,4.375,401,10,15,25,1
2784,Pasta with Tomatoes and Goat Cheese,4.375,605,25,13,349,1
2785,Fennel and Endive Salad with Orange Vinaigrette,3.125,122,2,7,176,1
2786,Chinese Orange Chicken,4.375,642,27,44,343,0
2787,Maple Pumpkin Pie,4.375,208,3,8,186,0
2788,Minted Turkish Delight Marinade,4.375,108,6,4,965,0
2789,Red-Wine Marinated Fried Chicken with Onions,4.375,561,37,33,584,0
2790,Grilled Goat Cheese with Fig Preserves,4.375,110,3,7,84,1
2791,Carrot Cake with Maple-Cream Cheese Icing,5.0,697,6,39,535,1
2792,Beef Tenderloin with Spring Vegetables,5.0,935,51,73,693,0
2793,Mixed-Herb Pasta with Red Bell Peppers and Feta,3.75,996,34,38,566,1
2794,Perfect White Rice,3.75,207,3,5,588,0
2795,Fresh Cranberry Orange Sauce,4.375,277,1,0,5,0
2796,Poached Oysters in Fennel-Saffron Soup,4.375,396,17,31,913,0
2797,Grilled Paillards of Beef with Red Wine and Port Sauce,4.375,537,31,28,249,0
2798,Wheat-Berry Salad with Grilled Tofu,3.125,935,26,70,1302,0
2799,Roasted Rhubarb Tarts with Strawberry Sauce,4.375,575,7,37,221,1
2800,Baguette Toasts,5.0,44,1,1,75,0
2801,Medallions of Pork with Dried Cherry Sauce,4.375,535,50,28,177,0
2802,Horseradish Mashed Potatoes,3.75,258,5,14,109,1
2803,Moroccan Chicken and Lentils,4.375,430,22,27,684,0
2804,Grilled Flank Steak,4.375,465,36,34,674,0
2805,Date Nut Cookie Pies,5.0,243,2,20,176,0
2806,Ham and Sage Ponice,2.5,273,19,10,629,0
2807,Orange Cheesecake Brownies,3.75,258,4,15,160,0
2808,Negrone,4.375,317,0,0,3,0
2809,Caramelized Onions with Barbecue Sauce,4.375,154,1,7,590,0
2810,Kale Minestrone with Pistou,5.0,527,23,22,943,0
2811,Romaine and Fennel Salad with Red Wine Vinaigrette,3.75,324,12,28,419,0
2812,Banana-Macadamia Nut Muffins,4.375,285,4,17,217,1
2813,Chocolate-on-Chocolate Tart with Maple Almonds,4.375,437,9,36,342,1
2814,Peanut Butter Cake with Chocolate-Peanut Butter Icing,4.375,668,15,35,341,0
2815,Fig and Walnut Truffles,3.75,121,1,10,6,1
2816,Borscht,2.5,303,8,7,529,0
2817,Lemon-Pistachio Pilaf,3.75,258,7,9,163,0
2818,Pork and Apple Pie with Cheddar-Sage Crust,4.375,890,28,58,548,0
2819,Spicy Crab and Melon Salad,4.375,361,19,16,659,0
2820,Caraway Parsley Potatoes,4.375,162,4,3,35,0
2821,"Lemon- and Garlic-Roasted Chicken with Fava Beans, Radishes, and Pecorino",4.375,882,62,65,1629,0
2822,Sausage and Wild Mushroom Lasagne with Red Pepper Tomato Sauce,4.375,837,54,50,1490,0
2823,Baked Yams with Ginger-Molasses Butter,4.375,392,4,15,137,1
2824,"Smoked Salmon, Cream Cheese, and Dill Stuffed Eggs",3.75,64,5,5,102,0
2825,Spice-Rubbed Pork Tenderloins in Corn Husks with Cranberry-Avocado Salsa,4.375,767,5,4,293,0
2826,Black Bean Tostadas with Curly Endive Salad,4.375,630,19,37,364,1
2827,Rice Noodles with Garlic and Herbs,3.75,635,5,42,820,1
2828,"Grilled Salmon with Orzo, Feta, and Red Wine Vinaigrette",5.0,812,42,55,363,0
2829,Oatmeal Wheat Bread,4.375,348,5,24,330,1
2830,Braised Chicken with Celery Root and Garlic,4.375,889,68,58,1322,0
2831,Smoked Chicken and Sugar Snap Pea Salad with Mint,4.375,234,20,13,61,0
2832,Spicy Sweet Corn and Poblano Soup,4.375,266,6,19,228,0
2833,Italian Spoon Biscuits with Tomato Sauce and Cheese,3.125,331,16,19,898,0
2834,Nutmeg-Coated Creamy French Toast,3.75,868,24,54,856,1
2835,Mulled Wine,2.5,172,0,0,10,0
2836,Cheesy Baked Penne with Cauliflower and Crème Fraîche,4.375,778,25,56,633,1
2837,"Mixed Greens with Grapefruit, Fennel, and Parmesan",3.75,258,7,22,249,1
2838,"Acorn Squash Stuffed with Wild Rice, Hazelnuts and Dried Cranberries",3.75,527,13,17,24,1
2839,Turkish Lamb Burgers,4.375,615,34,43,989,0
2840,Crab Meat and Beet Purée on Granny Smith Apple,3.125,13,1,0,44,0
2841,Charred Tomatillo Salsa Verde,4.375,83,2,5,15,1
2842,Surfer's Granola,2.5,303,8,16,157,1
2843,Accidental Chicken,3.75,576,36,37,461,0
2844,Apple Pie with Hazelnuts and Dried Sour Cherries,3.125,863,9,47,169,1
2845,Johnnycake Bread,5.0,284,6,10,283,0
2846,Guajillo and Tomatillo Salsa,4.375,46,1,1,4,1
2847,Horseradish Cream,5.0,122,1,12,142,1
2848,Guinness Mustard,4.375,62,3,3,854,1
2849,Roasted Beet Salad,4.375,200,3,13,360,1
2850,Creamed Lemon Spinach,4.375,183,9,11,295,0
2851,Cucumber Raita,4.375,87,5,4,59,0
2852,Corn-Crusted Red Snapper with Achiote Shrimp,4.375,818,58,24,499,0
2853,Mocha Pecan Pie with Coffee Whipped Cream,4.375,535,6,29,166,1
2854,Basmati Rice with Summer Vegetable Salad,3.75,656,9,38,151,1
2855,Carrots with Almond Purée,3.75,439,6,34,402,1
2856,Cinnamon Swirl Coffee Cake,4.375,379,6,15,271,1
2857,Green Mayonnaise,5.0,202,0,22,174,0
2858,Watermelon with Parmesan and Mint,3.75,51,1,1,66,1
2859,Zesty Pinto Beans,3.125,355,19,9,138,0
2860,Raisin Rice Pudding,4.375,320,9,12,136,0
2861,Gingered Vegetable Stir-Fry,3.75,91,2,5,459,0
2862,Cranberry Coconut Layer Cake,3.125,783,9,34,516,1
2863,Molasses-and-Buttermilk Gingerbread Squares,4.375,153,2,6,63,1
2864,"Grilled Corn on the Cob with Garlic Butter, Fresh Lime, and Queso Fresco",4.375,491,8,40,724,1
2865,Crab Cakes,4.375,303,19,17,687,0
2866,Herb Roasted Lamb Chops,5.0,140,4,13,968,0
2867,Broiled Plums with Mango Sorbet,4.375,177,0,0,7,1
2868,Sweet-Potato Salad with Mustard Viniagrette,4.375,247,3,9,230,1
2869,Beef Tenderloin with Smoked Paprika Mayonnaise,5.0,596,34,50,221,0
2870,Blue Cheese and Walnut Toasts,3.75,53,1,4,74,1
2871,Thyme Garlic Butter,5.0,207,0,23,172,0
2872,Sesame Wonton Crisps,4.375,360,4,30,327,1
2873,Tangy Chocolate Frosting,4.375,227,2,13,10,1
2874,Peppery Pasta Carbonara with Poached Egg,4.375,792,29,35,464,0
2875,Grilled Ham and Swiss Sandwiches,4.375,432,29,29,817,0
2876,Soy-Ginger Beef and Noodle Salad with Peanut Dressing,3.75,627,29,30,1418,0
2877,Honey-Glazed Baby Carrots,3.125,67,1,2,74,0
2878,Lemon Meringue Buttercream,4.375,344,2,31,56,1
2879,Spiced Quinoa Timbales,3.75,66,2,3,266,0
2880,Papaya in Cinnamon Syrup,3.125,282,1,1,17,1
2881,Baby Peas with Mustard Horseradish Butter,3.75,116,3,8,365,1
2882,Grapefruit Pie,5.0,447,3,16,219,0
2883,Yellow Rice with Sofrito,3.75,299,5,5,593,1
2884,Bibb Lettuce and Celery-Leaf Salad,3.75,77,2,7,70,1
2885,Banana Rum Cream Pie,4.375,376,3,30,179,1
2886,Chicken Stock,5.0,22,2,1,75,0
2887,Chocolate Wafer and Graham Cracker Brownies,2.5,277,4,14,204,0
2888,Scallops with Hazelnuts and Browned Butter Vinaigrette,4.375,500,31,36,912,0
2889,Khao Plow,5.0,414,8,1,6,1
2890,Khao Neeo,3.75,351,6,1,1,1
2891,Seared Scallops with Fresh Fennel Salad and Kumquat-Tarragon Vinaigrette,4.375,417,14,34,449,0
2892,Herbed Rice,4.375,359,7,1,7,1
2893,Koffie Van Brunt,3.75,234,1,6,11,0
2894,Barramundi Fillets With Roasted Sweet Potatoes and Brussels Sprout Chips,4.375,599,15,33,69,0
2895,Bacony Roasted Chickpeas,3.75,259,12,10,451,0
2896,Chorizo-Filled Dates,4.375,233,5,12,200,0
2897,"""California Roll"" Salad",4.375,369,9,13,953,1
2898,Rainbow Slaw,4.375,329,2,27,237,1
2899,Couscous with Apricots,3.125,283,6,11,446,1
2900,Chicken Negimaki with Spicy Red Pepper Dipping Sauce,4.375,41,4,2,63,0
2901,Rhubarb Roulade,3.75,256,6,3,100,1
2902,Gluten-Free Vegan Oatmeal Raisin Cookies,3.75,159,2,7,101,1
2903,Lamb Stew with Black Mustard Seeds,2.5,823,41,63,740,0
2904,Turkey Posole,4.375,282,19,9,1235,0
2905,Rum Refresher,4.375,141,1,0,4,0
2906,Braised Rabbit with Egg Noodles,3.75,617,43,26,685,0
2907,Golden Milk Turmeric Tea,5.0,88,2,5,27,1
2908,Minute Steak with Roasted Fennel and Arugula and Caper Dressing,5.0,322,14,27,275,0
2909,Potato and Seafood Salad with Tarragon,3.75,261,16,10,490,0
2910,Quick Pickled Cucumbers,4.375,213,1,0,1438,0
2911,Braised Veal with Gremolata,4.375,318,42,13,151,0
2912,"Penne with Fried Sardines, Capers, and Parsley",3.125,1007,29,59,390,0
2913,Lemon-Oregano Chicken,4.375,568,58,33,779,0
2914,Hungarian Blintz Loaf (Palacsinta Felfujt),3.125,385,11,28,310,1
2915,Seven-Vegetable Couscous with Chunky Onion Harissa,4.375,610,11,37,196,0
2916,Peach Ice Cream with Vanilla-Scented Peaches,3.75,326,4,13,41,0
2917,Sardine Puffs,4.375,17,0,1,24,0
2918,Baked Cheddar Olives,4.375,167,4,12,377,0
2919,Ham and Munster Buns with Honey Mustard,4.375,235,11,10,432,0
2920,Bratwurst with Creamy Apple Compote,4.375,842,25,66,1453,0
2921,Sweet Rosemary Syrup,3.125,150,0,0,3,0
2922,"Corn Bread, Green Chili and Pine Nut Stuffing",4.375,482,9,27,321,0
2923,Lamb with White Poppy Seeds,3.75,910,42,73,1318,0
2924,Pork with Gorgonzola Sauce,4.375,430,48,24,450,0
2925,Steamed Fingerling Potatoes in White Wine,2.5,221,5,5,14,1
2926,"Pork Loin with Apples, Prunes, and Mustard Cream Sauce",4.375,505,50,24,675,0
2927,Persian Rice Salad,4.375,510,9,26,404,1
2928,Cleansing Ginger-Chicken Soup,3.75,409,29,29,155,0
2929,"Potato, Carrot, and Zucchini Kugel",3.75,324,9,15,891,1
2930,Coconut Cream Tartlets,4.375,611,7,35,411,0
2931,Warm Lentil Salad with Sausage,4.375,923,34,58,1258,0
2932,Grilled Ground Lamb Kebabs with Fresh Hot-Pepper Paste,4.375,166,8,13,187,0
2933,Harvey Wallbanger,5.0,192,1,0,3,1
2934,Halibut on Mashed Fava Beans with Mint,4.375,515,45,24,394,0
2935,Marinated Vegetable Salad,3.75,238,4,19,146,0
2936,"Artichokes with Romano, Cracked Pepper and Olive",3.75,598,18,48,1059,1
2937,Polenta Tamale Pie,4.375,811,32,29,1173,0
2938,Vanilla-Scented Pear Strudel with Hazelnuts and Chocolate Sauce,4.375,1044,9,66,237,1
2939,Pigs in Sleeping Bags,3.75,261,7,18,175,0
2940,Braised Baby Onions with Orange Juice and Balsamic Vinegar,4.375,182,2,9,14,1
2941,Linguine with Eggplant,3.125,495,15,18,351,1
2942,Coconut Rice Pudding,4.375,310,8,12,229,1
2943,Provencal Vegetable and Goat Cheese Terrine,3.125,317,14,24,338,1
2944,Yam and Russet Potato Salad with Greens and Bacon,4.375,480,8,32,306,0
2945,Watercress and Mango Salad,4.375,245,4,13,426,0
2946,Pear-Cranberry Crisp with Cinnamon Ice Cream,4.375,422,4,15,6,0
2947,Strawberry and Peach Sangria,5.0,253,1,0,12,0
2948,Cream of Zucchini and Anise Soup,3.125,114,2,8,17,1
2949,Tomatillo Salsa with Serranos,5.0,73,1,5,361,0
2950,Gialina's Kale & Farro Salad with Avocado,4.375,687,7,65,386,1
2951,Arugula and Radicchio with Feta and Dates,4.375,201,3,16,147,1
2952,Frozen Raspberry Mousse,3.75,299,2,15,22,1
2953,Spinach and Lentil Soup,4.375,202,13,6,1043,0
2954,"Butternut Squash, Parmesan, and Sage Pizzas",3.75,281,11,4,565,0
2955,"Linguine with Pecorino, Tomatoes, and Arugula",3.75,886,35,47,974,1
2956,Bubby's Granola,2.5,407,10,11,23,1
2957,"Potato Salad with Olives, Tomatoes, and Capers",4.375,325,8,15,194,0
2958,Rotelle with Broccoli and Spicy Peanut Sauce,3.75,720,28,21,872,1
2959,The Three Amigos,2.5,482,20,22,34,1
2960,Whipped Parsnips,4.375,288,6,19,64,1
2961,Chocolate-Hazelnut Mousse,3.75,531,9,41,150,1
2962,"Mango, Blueberry, and Ginger Fruit Salad",4.375,188,2,1,10,1
2963,Chocolate-Tequila Sundaes,4.375,875,10,58,96,1
2964,Sweet Chutney,5.0,266,0,22,182,0
2965,Hot Chutney,4.375,108,3,2,623,0
2966,Cranberry Sauce with Mustard Seeds and Orange,4.375,77,1,2,7,0
2967,Pound Cake with Fresh Strawberries and Balsamic Sabayon,2.5,759,7,17,324,1
2968,"Spaghetti with Olive Oil, Garlic and Anchovies",4.375,731,23,32,1049,0
2969,Meena's Cinnamon and Currant Rolls,4.375,127,3,2,34,1
2970,Smoked Salmon Pasta Verde,3.125,517,20,11,230,0
2971,Tarragon Lime Bay Scallops Over Angel-Hair Pasta,3.125,591,32,19,675,0
2972,Pumpkin Custard Profiteroles with Maple Caramel,4.375,406,6,29,150,1
2973,Marmalade-Stuffed French Toast with Orange Syrup,4.375,329,11,23,253,1
2974,Jerusalem Artichoke Soup with Pumpernickel Croutons,3.75,274,6,10,387,0
2975,Scrambled Eggs with Cream Cheese and Scallions,3.125,300,15,25,251,1
2976,Cinnamon Cauliflower,3.75,120,1,12,259,0
2977,"Potato Gratin with Goat Cheese, Tomatoes, and Olives",3.75,400,10,20,406,0
2978,Couscous-Stuffed Tomatoes with Currants and Herbs,3.75,207,7,6,89,0
2979,Tarragon-Spiked Lady Grey Iced Tea,3.75,168,1,0,23,0
2980,Cornmeal and Currant Griddlecakes with Apple-Cinnamon Syrup,4.375,613,11,17,662,0
2981,"Carrots with Shallots, Sage, and Thyme",4.375,156,3,7,191,0
2982,Sour Cream-Orange Coffee Cake with Chocolate-Pecan Streusel,3.75,707,8,39,381,1
2983,Fish Fillets Dijon,4.375,237,20,13,270,0
2984,Yellow Squash Casserole,3.75,255,4,16,456,0
2985,Raspberry Buttermilk Cake,5.0,275,4,9,285,1
2986,Calcutta Lobster in Spinach and Yogurt Sauce,3.75,274,33,11,1295,0
2987,Grilled Yellow Squash with Oregano,4.375,219,1,17,7,1
2988,Pappardelle in Lemon Cream Sauce with Asparagus and Smoked Salmon,4.375,635,19,19,24,0
2989,Papaya Lime Fool,2.5,173,1,7,20,1
2990,Sweet Potato Rolls,4.375,345,5,16,323,0
2991,Salade Niçoise Sandwich,3.75,215,8,15,461,0
2992,Asian Pork Crepes,3.75,20,1,1,37,0
2993,Hotel Benson Eggs,3.125,704,44,42,1094,0
2994,Salmon and Spinach Strudel,4.375,525,33,37,363,0
2995,Basil Pesto,4.375,605,12,61,239,1
2996,Espresso and Amaretti Bavarois with Mascarpone Cream Sauce,4.375,718,8,60,179,0
2997,Papaya-Mint Sauce,3.75,130,0,0,2,0
2998,Escarole and Bacon Crostini with Mostarda,5.0,709,30,62,1534,0
2999,Lamb Tikka with Crispy Onions,4.375,460,34,31,132,0
3000,Maple-Cinnamon Toast With Citrus and Crème Fraîche,2.5,610,3,35,88,1
3001,Yam Soup with Coriander,3.75,193,10,7,145,0
3002,Red Pork and Bean Chili,2.5,301,20,21,430,0
3003,Chocolate-Cinnamon Coffee Cake,4.375,265,5,11,140,1
3004,Roast Fillet of Beef with Chipotle Red Pepper Sauce and Mustard Chive Sauce,3.75,674,42,53,660,0
3005,Green Beans with Balsamic-Shallot Butter,3.75,114,3,6,14,1
3006,Moroccan-Style Potato and Egg Sandwiches,4.375,422,15,19,589,0
3007,Halibut Ceviche With Tomato and Cucumber,5.0,119,7,5,29,0
3008,Frozen Lemon Mousse with Blueberry Sauce,3.125,282,4,12,53,1
3009,Minted Couscous with Currants and Pine Nuts,4.375,423,12,16,42,0
3010,"Zucchini, Tomato, and Corn Salad",4.375,209,4,15,745,1
3011,Grilled Chicken Breasts with North African Spice Paste,4.375,646,58,43,1130,0
3012,"Farfalle with Chicken, Tomatoes, Caramelized Onions, and Goat Cheese",3.75,599,29,24,201,0
3013,"Spinach Salad with Shrimp, Fennel and Bacon-Balsamic Vinaigrette",3.75,472,32,30,1285,0
3014,Vegetarian Brown Rice Salad With Parsnips and Whipped Ricotta,5.0,935,18,65,1061,1
3015,Coconut Buttercream,4.375,226,2,6,232,1
3016,Avocado and Grapefruit Salad,4.375,216,2,17,423,1
3017,Gochujang-Date Sauce,5.0,140,4,5,1282,1
3018,Sweet Potato and Sausage Soup,4.375,343,14,16,422,0
3019,Goat Cheese Salad,4.375,204,6,13,213,1
3020,Cilantro-Lime Tartar Sauce,4.375,136,0,15,170,0
3021,Honey Custard in Phyllo Pastry,4.375,378,6,28,208,0
3022,Sage Stuffing,4.375,250,6,15,347,0
3023,Crispy Crepes with Dulce de Leche Sauce,4.375,275,4,24,107,0
3024,Asian Turkey Lettuce Wraps,4.375,454,39,23,895,0
3025,Lemon Blueberry Ice-Cream Cake,3.125,276,3,11,181,1
3026,Sauteed Pork Tenderloin and Pears in Mustard-Port Sauce,4.375,400,26,13,139,0
3027,"Oatmeal Cookies with Raisins, Dates, and Walnuts",4.375,153,2,6,50,0
3028,"Individual Zucchini, Lemon, and Ricotta Galettes",4.375,627,17,45,909,1
3029,Prosciutto-Wrapped Asparagus with Mint Dressing,4.375,80,7,4,544,0
3030,Korean-Style Tuna Tartare,5.0,213,28,8,83,0
3031,Coconut Shortbread Cookies,3.75,65,1,4,32,1
3032,Black-Olive Grissini,3.75,28,1,1,61,0
3033,Ropa Vieja,4.375,630,43,26,827,0
3034,Lemon Dill Baked Orzo with Gruyère,3.75,527,21,20,333,0
3035,Steak Salad with Pickled Vegetables,4.375,682,47,50,150,0
3036,Oyster Stuffing with Shiitake Mushrooms and Leeks,5.0,231,9,10,252,0
3037,Turkey Stock,4.375,111,18,4,100,0
3038,Avocado and Tomatillo Salsa,4.375,191,3,15,10,0
3039,Rump of Beef to Stew,2.5,678,60,39,936,0
3040,Shrimp and Leek Linguine in White Wine Sauce,3.75,734,31,23,786,0
3041,"Roasted Garlic, Onion and Red Bell Pepper Dip",3.75,332,6,30,383,1
3042,Butternut Squash Soup with Pancetta and Tomatoes,3.75,235,10,9,194,0
3043,Duck a l'Orange,4.375,585,49,22,160,0
3044,Passion-Fruit and Blackberry Jellies with Lemon Verbena Cream,3.75,299,2,8,16,0
3045,Trio of Salads,4.375,349,3,28,366,1
3046,Classic Escargots à la Bourguignonne,4.375,168,6,16,26,0
3047,Salmon Steaks with Red-Wine Butter,3.75,851,46,66,681,0
3048,Black Bean and Bell Pepper Salad,4.375,946,18,12,302,0
3049,"Roast Beef, Red Pepper, Spinach, and Feta Sandwiches with Tahini Dressing",4.375,395,22,19,498,0
3050,Savory Applesauce,4.375,307,1,1,4,0
